name,author,rating,year,genre
10-Day Green Smoothie Cleanse,JJ Smith,4.7,2016,Non Fiction
11/22/63: A Novel,Stephen King,4.6,2011,Fiction
12 Rules for Life: An Antidote to Chaos,Jordan B. Peterson,4.7,2018,Non Fiction
1984 (Signet Classics),George Orwell,4.7,2017,Fiction
"5,000 Awesome Facts (About Everything!) (National Geographic Kids)",National Geographic Kids,4.8,2019,Childrens
A Dance with Dragons (A Song of Ice and Fire),George R. R. Martin,4.4,2011,Fiction
A Game of Thrones / A Clash of Kings / A Storm of Swords / A Feast of Crows / A Dance with Dragons,George R. R. Martin,4.7,2014,Fiction
A Gentleman in Moscow: A Novel,Amor Towles,4.7,2017,Fiction
"A Higher Loyalty: Truth, Lies, and Leadership",James Comey,4.7,2018,Non Fiction
A Man Called Ove: A Novel,Fredrik Backman,4.6,2016,Fiction
A Patriot's History of the United States: From Columbus's Great Discovery to the War on Terror,Larry Schweikart,4.6,2010,Non Fiction
A Stolen Life: A Memoir,Jaycee Dugard,4.6,2011,Non Fiction
A Wrinkle in Time (Time Quintet),Madeleine L'Engle,4.5,2018,Fiction
"Act Like a Lady, Think Like a Man: What Men Really Think About Love, Relationships, Intimacy, and Commitment",Steve Harvey,4.6,2009,Non Fiction
"Adult Coloring Book Designs: Stress Relief Coloring Book: Garden Designs, Mandalas, Animals, and Paisley Patterns",Adult Coloring Book Designs,4.5,2016,Non Fiction
Adult Coloring Book: Stress Relieving Animal Designs,Blue Star Coloring,4.6,2015,Non Fiction
Adult Coloring Book: Stress Relieving Patterns,Blue Star Coloring,4.4,2015,Non Fiction
"Adult Coloring Books: A Coloring Book for Adults Featuring Mandalas and Henna Inspired Flowers, Animals, and Paisley…",Coloring Books for Adults,4.5,2015,Non Fiction
Alexander Hamilton,Ron Chernow,4.8,2016,Non Fiction
All the Light We Cannot See,Anthony Doerr,4.6,2014,Fiction
Allegiant,Veronica Roth,3.9,2013,Fiction
American Sniper: The Autobiography of the Most Lethal Sniper in U.S. Military History,Chris Kyle,4.6,2015,Non Fiction
And the Mountains Echoed,Khaled Hosseini,4.3,2013,Fiction
Arguing with Idiots: How to Stop Small Minds and Big Government,Glenn Beck,4.6,2009,Non Fiction
Astrophysics for People in a Hurry,Neil deGrasse Tyson,4.7,2017,Non Fiction
"Autobiography of Mark Twain, Vol. 1",Mark Twain,4.2,2010,Non Fiction
Baby Touch and Feel: Animals,DK,4.6,2015,Childrens
Balance (Angie's Extreme Stress Menders),Angie Grace,4.6,2015,Non Fiction
Barefoot Contessa Foolproof: Recipes You Can Trust: A Cookbook,Ina Garten,4.8,2012,Non Fiction
"Barefoot Contessa, How Easy Is That?: Fabulous Recipes & Easy Tips",Ina Garten,4.7,2010,Non Fiction
Becoming,Michelle Obama,4.8,2018,Non Fiction
Being Mortal: Medicine and What Matters in the End,Atul Gawande,4.8,2015,Non Fiction
Between the World and Me,Ta-Nehisi Coates,4.7,2015,Non Fiction
Born to Run,Bruce Springsteen,4.7,2016,Non Fiction
"Breaking Dawn (The Twilight Saga, Book 4)",Stephenie Meyer,4.6,2009,Fiction
"Broke: The Plan to Restore Our Trust, Truth and Treasure",Glenn Beck,4.5,2010,Non Fiction
"Brown Bear, Brown Bear, What Do You See?",Bill Martin Jr.,4.9,2017,Childrens
"Cabin Fever (Diary of a Wimpy Kid, Book 6)",Jeff Kinney,4.8,2011,Childrens
Calm the F*ck Down: An Irreverent Adult Coloring Book (Irreverent Book Series),Sasha O'Hara,4.6,2016,Non Fiction
Can't Hurt Me: Master Your Mind and Defy the Odds,David Goggins,4.8,2019,Non Fiction
Capital in the Twenty First Century,Thomas Piketty,4.5,2014,Non Fiction
Catching Fire (The Hunger Games),Suzanne Collins,4.7,2010,Fiction
Cravings: Recipes for All the Food You Want to Eat: A Cookbook,Chrissy Teigen,4.7,2016,Non Fiction
Crazy Love: Overwhelmed by a Relentless God,Francis Chan,4.7,2009,Non Fiction
Crazy Rich Asians (Crazy Rich Asians Trilogy),Kevin Kwan,4.3,2018,Fiction
Creative Haven Creative Cats Coloring Book (Adult Coloring),Marjorie Sarnat,4.8,2015,Non Fiction
Creative Haven Owls Coloring Book (Adult Coloring),Marjorie Sarnat,4.8,2015,Non Fiction
Cutting for Stone,Abraham Verghese,4.6,2010,Fiction
"Daring Greatly: How the Courage to Be Vulnerable Transforms the Way We Live, Love, Parent, and Lead",Brené Brown,4.8,2013,Non Fiction
"David and Goliath: Underdogs, Misfits, and the Art of Battling Giants",Malcolm Gladwell,4.4,2013,Non Fiction
Dead And Gone: A Sookie Stackhouse Novel (Sookie Stackhouse/True Blood),Charlaine Harris,4.6,2009,Fiction
"Dead in the Family (Sookie Stackhouse/True Blood, Book 10)",Charlaine Harris,4.3,2010,Fiction
"Dead Reckoning (Sookie Stackhouse/True Blood, Book 11)",Charlaine Harris,4.2,2011,Fiction
Dear Zoo: A Lift-the-Flap Book,Rod Campbell,4.8,2015,Childrens
Decision Points,George W. Bush,4.6,2010,Non Fiction
"Delivering Happiness: A Path to Profits, Passion, and Purpose",Tony Hsieh,4.6,2010,Non Fiction
"Diagnostic and Statistical Manual of Mental Disorders, 5th Edition: DSM-5",American Psychiatric Association,4.5,2013,Non Fiction
"Diary of a Wimpy Kid: Hard Luck, Book 8",Jeff Kinney,4.8,2013,Childrens
Diary of a Wimpy Kid: The Last Straw (Book 3),Jeff Kinney,4.8,2009,Childrens
Diary of a Wimpy Kid: The Long Haul,Jeff Kinney,4.8,2014,Childrens
Difficult Riddles For Smart Kids: 300 Difficult Riddles And Brain Teasers Families Will Love (Books for Smart Kids),M Prefontaine,4.6,2019,Childrens
Divergent,Veronica Roth,4.6,2013,Fiction
Divergent / Insurgent,Veronica Roth,4.5,2014,Fiction
"Divine Soul Mind Body Healing and Transmission System: The Divine Way to Heal You, Humanity, Mother Earth, and All…",Zhi Gang Sha,4.6,2009,Non Fiction
Doctor Sleep: A Novel,Stephen King,4.7,2013,Fiction
"Dog Days (Diary of a Wimpy Kid, Book 4) (Volume 4)",Jeff Kinney,4.8,2009,Childrens
Dog Man and Cat Kid: From the Creator of Captain Underpants (Dog Man #4),Dav Pilkey,4.9,2018,Childrens
Dog Man: A Tale of Two Kitties: From the Creator of Captain Underpants (Dog Man #3),Dav Pilkey,4.9,2017,Childrens
Dog Man: Brawl of the Wild: From the Creator of Captain Underpants (Dog Man #6),Dav Pilkey,4.9,2018,Childrens
Dog Man: Fetch-22: From the Creator of Captain Underpants (Dog Man #8),Dav Pilkey,4.9,2019,Childrens
Dog Man: For Whom the Ball Rolls: From the Creator of Captain Underpants (Dog Man #7),Dav Pilkey,4.9,2019,Childrens
Dog Man: Lord of the Fleas: From the Creator of Captain Underpants (Dog Man #5),Dav Pilkey,4.9,2018,Childrens
Double Down (Diary of a Wimpy Kid #11),Jeff Kinney,4.8,2016,Childrens
Dover Creative Haven Art Nouveau Animal Designs Coloring Book (Creative Haven Coloring Books),Marty Noble,4.6,2015,Non Fiction
Drive: The Surprising Truth About What Motivates Us,Daniel H. Pink,4.5,2010,Non Fiction
Eat This Not That! Supermarket Survival Guide: The No-Diet Weight Loss Solution,David Zinczenko,4.5,2009,Non Fiction
"Eat This, Not That! Thousands of Simple Food Swaps that Can Save You 10, 20, 30 Pounds--or More!",David Zinczenko,4.3,2009,Non Fiction
"Eat to Live: The Amazing Nutrient-Rich Program for Fast and Sustained Weight Loss, Revised Edition",Joel Fuhrman MD,4.5,2011,Non Fiction
Eclipse (Twilight Sagas),Stephenie Meyer,4.7,2009,Fiction
Eclipse (Twilight),Stephenie Meyer,4.7,2009,Fiction
Educated: A Memoir,Tara Westover,4.7,2018,Non Fiction
"Enchanted Forest: An Inky Quest and Coloring book (Activity Books, Mindfulness and Meditation, Illustrated Floral Prints…",Johanna Basford,4.7,2015,Non Fiction
Fahrenheit 451,Ray Bradbury,4.6,2016,Fiction
Fantastic Beasts and Where to Find Them: The Original Screenplay (Harry Potter),J.K. Rowling,4.7,2016,Fiction
Fear: Trump in the White House,Bob Woodward,4.4,2018,Non Fiction
Fifty Shades Darker,E L James,4.4,2012,Fiction
Fifty Shades Freed: Book Three of the Fifty Shades Trilogy (Fifty Shades of Grey Series) (English Edition),E L James,4.5,2012,Fiction
Fifty Shades of Grey: Book One of the Fifty Shades Trilogy (Fifty Shades of Grey Series),E L James,3.8,2012,Fiction
Fifty Shades Trilogy (Fifty Shades of Grey / Fifty Shades Darker / Fifty Shades Freed),E L James,4.5,2012,Fiction
Fire and Fury: Inside the Trump White House,Michael Wolff,4.2,2018,Non Fiction
First 100 Words,Roger Priddy,4.7,2014,Non Fiction
Food Rules: An Eater's Manual,Michael Pollan,4.4,2010,Non Fiction
Frozen (Little Golden Book),RH Disney,4.7,2014,Fiction
"Game Change: Obama and the Clintons, McCain and Palin, and the Race of a Lifetime",John Heilemann,4.4,2010,Non Fiction
Game of Thrones Boxed Set: A Game of Thrones/A Clash of Kings/A Storm of Swords/A Feast for Crows,George R.R. Martin,4.6,2011,Fiction
George Washington's Sacred Fire,Peter A. Lillback,4.5,2010,Non Fiction
George Washington's Secret Six: The Spy Ring That Saved the American Revolution,Brian Kilmeade,4.6,2013,Non Fiction
Giraffes Can't Dance,Giles Andreae,4.8,2015,Childrens
"Girl, Stop Apologizing: A Shame-Free Plan for Embracing and Achieving Your Goals",Rachel Hollis,4.6,2019,Non Fiction
"Girl, Wash Your Face: Stop Believing the Lies About Who You Are So You Can Become Who You Were Meant to Be",Rachel Hollis,4.6,2018,Non Fiction
"Glenn Beck's Common Sense: The Case Against an Out-of-Control Government, Inspired by Thomas Paine",Glenn Beck,4.6,2009,Non Fiction
Go Set a Watchman: A Novel,Harper Lee,3.6,2015,Fiction
Go the F**k to Sleep,Adam Mansbach,4.8,2011,Fiction
Going Rogue: An American Life,Sarah Palin,4.6,2009,Non Fiction
Gone Girl,Gillian Flynn,4.0,2012,Fiction
Good Days Start With Gratitude: A 52 Week Guide To Cultivate An Attitude Of Gratitude: Gratitude Journal,Pretty Simple Press,4.6,2019,Non Fiction
Good to Great: Why Some Companies Make the Leap and Others Don't,Jim Collins,4.5,2009,Non Fiction
Goodnight Moon,Margaret Wise Brown,4.8,2017,Fiction
"Goodnight, Goodnight Construction Site (Hardcover Books for Toddlers, Preschool Books for Kids)",Sherri Duskey Rinker,4.9,2012,Childrens
"Grain Brain: The Surprising Truth about Wheat, Carbs, and Sugar--Your Brain's Silent Killers",David Perlmutter MD,4.6,2014,Non Fiction
Grey: Fifty Shades of Grey as Told by Christian (Fifty Shades of Grey Series),E L James,4.4,2015,Fiction
Guts,Raina Telgemeier,4.8,2019,Non Fiction
Hamilton: The Revolution,Lin-Manuel Miranda,4.9,2016,Non Fiction
"Happy, Happy, Happy: My Life and Legacy as the Duck Commander",Phil Robertson,4.8,2013,Non Fiction
"Harry Potter and the Chamber of Secrets: The Illustrated Edition (Harry Potter, Book 2)",J.K. Rowling,4.9,2016,Fiction
"Harry Potter and the Cursed Child, Parts 1 & 2, Special Rehearsal Edition Script",J.K. Rowling,4.0,2016,Fiction
"Harry Potter and the Goblet of Fire: The Illustrated Edition (Harry Potter, Book 4) (4)",J. K. Rowling,4.9,2019,Fiction
"Harry Potter and the Prisoner of Azkaban: The Illustrated Edition (Harry Potter, Book 3)",J.K. Rowling,4.9,2017,Fiction
"Harry Potter and the Sorcerer's Stone: The Illustrated Edition (Harry Potter, Book 1)",J.K. Rowling,4.9,2016,Fiction
Harry Potter Coloring Book,Scholastic,4.7,2015,Non Fiction
Harry Potter Paperback Box Set (Books 1-7),J. K. Rowling,4.8,2016,Fiction
Have a Little Faith: A True Story,Mitch Albom,4.8,2009,Non Fiction
Heaven is for Real: A Little Boy's Astounding Story of His Trip to Heaven and Back,Todd Burpo,4.7,2011,Non Fiction
Hillbilly Elegy: A Memoir of a Family and Culture in Crisis,J. D. Vance,4.4,2016,Non Fiction
Homebody: A Guide to Creating Spaces You Never Want to Leave,Joanna Gaines,4.8,2018,Non Fiction
How to Win Friends & Influence People,Dale Carnegie,4.7,2014,Non Fiction
Howard Stern Comes Again,Howard Stern,4.3,2019,Non Fiction
Humans of New York,Brandon Stanton,4.8,2013,Non Fiction
Humans of New York : Stories,Brandon Stanton,4.9,2015,Non Fiction
"Hyperbole and a Half: Unfortunate Situations, Flawed Coping Mechanisms, Mayhem, and Other Things That Happened",Allie Brosh,4.7,2013,Non Fiction
"I Am Confident, Brave & Beautiful: A Coloring Book for Girls",Hopscotch Girls,4.8,2019,Non Fiction
"I, Alex Cross",James Patterson,4.6,2009,Fiction
If Animals Kissed Good Night,Ann Whitford Paul,4.8,2017,Fiction
If I Stay,Gayle Forman,4.3,2014,Fiction
"In the Garden of Beasts: Love, Terror, and an American Family in Hitler's Berlin",Eric Larson,4.4,2011,Non Fiction
Inferno,Dan Brown,4.1,2013,Fiction
Inheritance: Book IV (Inheritance Cycle),Christopher Paolini,4.6,2011,Fiction
Instant Pot Pressure Cooker Cookbook: 500 Everyday Recipes for Beginners and Advanced Users. Try Easy and Healthy…,Jennifer Smith,4.4,2019,Non Fiction
It's Not Supposed to Be This Way: Finding Unexpected Strength When Disappointments Leave You Shattered,Lysa TerKeurst,4.8,2019,Non Fiction
Jesus Calling: Enjoying Peace in His Presence (with Scripture References),Sarah Young,4.9,2011,Non Fiction
JOURNEY TO THE ICE P,RH Disney,4.6,2014,Fiction
Joyland (Hard Case Crime),Stephen King,4.5,2013,Fiction
Killers of the Flower Moon: The Osage Murders and the Birth of the FBI,David Grann,4.6,2017,Non Fiction
Killing Jesus (Bill O'Reilly's Killing Series),Bill O'Reilly,4.5,2013,Non Fiction
Killing Kennedy: The End of Camelot,Bill O'Reilly,4.6,2012,Non Fiction
Killing Lincoln: The Shocking Assassination that Changed America Forever (Bill O'Reilly's Killing Series),Bill O'Reilly,4.7,2011,Non Fiction
Killing Patton: The Strange Death of World War II's Most Audacious General (Bill O'Reilly's Killing Series),Bill O'Reilly,4.6,2014,Non Fiction
Killing Reagan: The Violent Assault That Changed a Presidency (Bill O'Reilly's Killing Series),Bill O'Reilly,4.6,2015,Non Fiction
Killing the Rising Sun: How America Vanquished World War II Japan (Bill O'Reilly's Killing Series),Bill O'Reilly,4.8,2016,Non Fiction
Kitchen Confidential Updated Edition: Adventures in the Culinary Underbelly (P.S.),Anthony Bourdain,4.8,2018,Non Fiction
Knock-Knock Jokes for Kids,Rob Elliott,4.5,2013,Childrens
"Last Week Tonight with John Oliver Presents A Day in the Life of Marlon Bundo (Better Bundo Book, LGBT Childrens Book)",Jill Twiss,4.9,2018,Fiction
Laugh-Out-Loud Jokes for Kids,Rob Elliott,4.6,2013,Childrens
"Lean In: Women, Work, and the Will to Lead",Sheryl Sandberg,4.5,2013,Non Fiction
Leonardo da Vinci,Walter Isaacson,4.5,2017,Non Fiction
Lettering and Modern Calligraphy: A Beginner's Guide: Learn Hand Lettering and Brush Lettering,Paper Peony Press,4.4,2018,Non Fiction
Liberty and Tyranny: A Conservative Manifesto,Mark R. Levin,4.8,2009,Non Fiction
Life,Keith Richards,4.5,2010,Non Fiction
Little Bee: A Novel,Chris Cleave,4.1,2010,Fiction
Little Blue Truck,Alice Schertle,4.9,2014,Fiction
Little Fires Everywhere,Celeste Ng,4.5,2018,Fiction
Looking for Alaska,John Green,4.5,2014,Fiction
"Love Wins: A Book About Heaven, Hell, and the Fate of Every Person Who Ever Lived",Rob Bell,4.2,2011,Non Fiction
Love You Forever,Robert Munsch,4.8,2014,Childrens
Magnolia Table: A Collection of Recipes for Gathering,Joanna Gaines,4.8,2018,Non Fiction
Make It Ahead: A Barefoot Contessa Cookbook,Ina Garten,4.5,2014,Non Fiction
Make Your Bed: Little Things That Can Change Your Life...And Maybe the World,Admiral William H. McRaven,4.7,2017,Non Fiction
"Mastering the Art of French Cooking, Vol. 2",Julia Child,4.8,2009,Non Fiction
Milk and Honey,Rupi Kaur,4.7,2016,Non Fiction
Milk and Vine: Inspirational Quotes From Classic Vines,Adam Gasiewski,4.4,2017,Non Fiction
Mindset: The New Psychology of Success,Carol S. Dweck,4.6,2014,Non Fiction
Mockingjay (The Hunger Games),Suzanne Collins,4.5,2010,Fiction
"National Geographic Kids Why?: Over 1,111 Answers to Everything",Crispin Boyer,4.8,2019,Childrens
National Geographic Little Kids First Big Book of Why (National Geographic Little Kids First Big Books),Amy Shields,4.8,2019,Childrens
New Moon (The Twilight Saga),Stephenie Meyer,4.6,2009,Fiction
Night (Night),Elie Wiesel,4.7,2016,Non Fiction
No Easy Day: The Autobiography of a Navy Seal: The Firsthand Account of the Mission That Killed Osama Bin Laden,Mark Owen,4.6,2012,Non Fiction
Obama: An Intimate Portrait,Pete Souza,4.9,2017,Non Fiction
"Oh, the Places You'll Go!",Dr. Seuss,4.9,2012,Childrens
Old School (Diary of a Wimpy Kid #10),Jeff Kinney,4.8,2015,Childrens
Olive Kitteridge,Elizabeth Strout,4.2,2009,Fiction
One Thousand Gifts: A Dare to Live Fully Right Where You Are,Ann Voskamp,4.6,2011,Non Fiction
"Option B: Facing Adversity, Building Resilience, and Finding Joy",Sheryl Sandberg,4.5,2017,Non Fiction
Origin: A Novel (Robert Langdon),Dan Brown,4.3,2017,Fiction
Orphan Train,Christina Baker Kline,4.6,2014,Fiction
Outliers: The Story of Success,Malcolm Gladwell,4.6,2009,Non Fiction
P is for Potty! (Sesame Street) (Lift-the-Flap),Naomi Kleinberg,4.7,2018,Childrens
Percy Jackson and the Olympians Paperback Boxed Set (Books 1-3),Rick Riordan,4.8,2010,Childrens
Player's Handbook (Dungeons & Dragons),Wizards RPG Team,4.8,2017,Fiction
Pokémon Deluxe Essential Handbook: The Need-to-Know Stats and Facts on Over 700 Pokémon,Scholastic,4.7,2016,Fiction
Proof of Heaven: A Neurosurgeon's Journey into the Afterlife,Eben Alexander,4.3,2012,Non Fiction
"Publication Manual of the American Psychological Association, 6th Edition",American Psychological Association,4.5,2009,Non Fiction
Puppy Birthday to You! (Paw Patrol) (Little Golden Book),Golden Books,4.8,2017,Fiction
Quiet: The Power of Introverts in a World That Can't Stop Talking,Susan Cain,4.6,2012,Non Fiction
Radical: Taking Back Your Faith from the American Dream,David Platt,4.7,2010,Non Fiction
Ready Player One: A Novel,Ernest Cline,4.6,2017,Fiction
Rush Revere and the Brave Pilgrims: Time-Travel Adventures with Exceptional Americans (1),Rush Limbaugh,4.9,2013,Fiction
Rush Revere and the First Patriots: Time-Travel Adventures With Exceptional Americans (2),Rush Limbaugh,4.9,2014,Fiction
"Salt, Fat, Acid, Heat: Mastering the Elements of Good Cooking",Samin Nosrat,4.8,2018,Non Fiction
Sarah's Key,Tatiana de Rosnay,4.6,2010,Fiction
"School Zone - Big Preschool Workbook - Ages 4 and Up, Colors, Shapes, Numbers 1-10, Alphabet, Pre-Writing, Pre-Reading…",School Zone,4.8,2018,Childrens
"Secret Garden: An Inky Treasure Hunt and Coloring Book (For Adults, mindfulness coloring)",Johanna Basford,4.7,2015,Non Fiction
Sh*t My Dad Says,Justin Halpern,4.7,2010,Non Fiction
Ship of Fools: How a Selfish Ruling Class Is Bringing America to the Brink of Revolution,Tucker Carlson,4.8,2018,Non Fiction
Shred: The Revolutionary Diet: 6 Weeks 4 Inches 2 Sizes,Ian K. Smith M.D.,4.1,2013,Non Fiction
Sookie Stackhouse,Charlaine Harris,4.7,2009,Fiction
"Soul Healing Miracles: Ancient and New Sacred Wisdom, Knowledge, and Practical Techniques for Healing the Spiritual…",Zhi Gang Sha,4.6,2013,Non Fiction
Steve Jobs,Walter Isaacson,4.6,2011,Non Fiction
Strange Planet (Strange Planet Series),Nathan W. Pyle,4.9,2019,Fiction
StrengthsFinder 2.0,Gallup,4.0,2009,Non Fiction
"Super Freakonomics: Global Cooling, Patriotic Prostitutes, and Why Suicide Bombers Should Buy Life Insurance",Steven D. Levitt,4.5,2009,Non Fiction
Switch: How to Change Things When Change Is Hard,Chip Heath,4.6,2010,Non Fiction
Sycamore Row (Jake Brigance),John Grisham,4.5,2013,Fiction
Teach Like a Champion: 49 Techniques that Put Students on the Path to College,Doug Lemov,4.4,2010,Non Fiction
The 17 Day Diet: A Doctor's Plan Designed for Rapid Results,Mike Moreno,4.3,2011,Non Fiction
"The 4 Hour Body: An Uncommon Guide to Rapid Fat Loss, Incredible Sex and Becoming Superhuman",Timothy Ferriss,4.3,2011,Non Fiction
The 5 Love Languages: The Secret to Love That Lasts,Gary Chapman,4.7,2010,Non Fiction
The 5 Love Languages: The Secret to Love that Lasts,Gary Chapman,4.8,2015,Non Fiction
The 5000 Year Leap,W. Cleon Skousen,4.8,2009,Non Fiction
The 7 Habits of Highly Effective People: Powerful Lessons in Personal Change,Stephen R. Covey,4.6,2009,Non Fiction
The Alchemist,Paulo Coelho,4.7,2014,Fiction
The Amateur,Edward Klein,4.6,2012,Non Fiction
The Art of Racing in the Rain: A Novel,Garth Stein,4.7,2010,Fiction
The Big Short: Inside the Doomsday Machine,Michael Lewis,4.7,2010,Non Fiction
The Blood of Olympus (The Heroes of Olympus (5)),Rick Riordan,4.8,2014,Fiction
"The Blood Sugar Solution: The UltraHealthy Program for Losing Weight, Preventing Disease, and Feeling Great Now!",Mark Hyman M.D.,4.2,2012,Non Fiction
"The Body Keeps the Score: Brain, Mind, and Body in the Healing of Trauma",Bessel van der Kolk M.D.,4.8,2019,Non Fiction
The Book of Basketball: The NBA According to The Sports Guy,Bill Simmons,4.7,2009,Non Fiction
The Book Thief,Markus Zusak,4.6,2013,Fiction
The Book with No Pictures,B. J. Novak,4.8,2014,Fiction
The Boys in the Boat: Nine Americans and Their Epic Quest for Gold at the 1936 Berlin Olympics,Daniel James Brown,4.8,2014,Non Fiction
The Casual Vacancy,J.K. Rowling,3.3,2012,Fiction
The China Study: The Most Comprehensive Study of Nutrition Ever Conducted And the Startling Implications for Diet…,Thomas Campbell,4.7,2011,Non Fiction
The Complete Ketogenic Diet for Beginners: Your Essential Guide to Living the Keto Lifestyle,Amy Ramos,4.3,2018,Non Fiction
The Confession: A Novel,John Grisham,4.3,2010,Fiction
The Constitution of the United States,Delegates of the Constitutional,4.8,2016,Non Fiction
The Daily Show with Jon Stewart Presents Earth (The Book): A Visitor's Guide to the Human Race,Jon Stewart,4.4,2010,Non Fiction
The Day the Crayons Quit,Drew Daywalt,4.8,2013,Fiction
"The Dukan Diet: 2 Steps to Lose the Weight, 2 Steps to Keep It Off Forever",Pierre Dukan,4.1,2011,Non Fiction
The Elegance of the Hedgehog,Muriel Barbery,4.0,2009,Fiction
The Fault in Our Stars,John Green,4.7,2012,Fiction
The Five Dysfunctions of a Team: A Leadership Fable,Patrick Lencioni,4.6,2009,Non Fiction
The Five Love Languages: How to Express Heartfelt Commitment to Your Mate,Gary Chapman,4.6,2009,Non Fiction
The Four Agreements: A Practical Guide to Personal Freedom (A Toltec Wisdom Book),Don Miguel Ruiz,4.7,2013,Non Fiction
The Getaway,Jeff Kinney,4.8,2017,Fiction
The Girl on the Train,Paula Hawkins,4.1,2015,Fiction
The Girl Who Kicked the Hornet's Nest (Millennium Trilogy),Stieg Larsson,4.7,2010,Fiction
The Girl Who Played with Fire (Millennium Series),Stieg Larsson,4.7,2010,Fiction
The Girl Who Played with Fire (Millennium),Stieg Larsson,4.7,2009,Fiction
The Girl with the Dragon Tattoo (Millennium Series),Stieg Larsson,4.4,2009,Fiction
The Going-To-Bed Book,Sandra Boynton,4.8,2016,Childrens
The Goldfinch: A Novel (Pulitzer Prize for Fiction),Donna Tartt,3.9,2013,Fiction
The Great Gatsby,F. Scott Fitzgerald,4.4,2012,Fiction
The Guardians: A Novel,John Grisham,4.5,2019,Fiction
The Guernsey Literary and Potato Peel Pie Society,Mary Ann Shaffer,4.7,2009,Fiction
The Handmaid's Tale,Margaret Atwood,4.3,2017,Fiction
The Harbinger: The Ancient Mystery that Holds the Secret of America's Future,Jonathan Cahn,4.6,2012,Fiction
The Hate U Give,Angie Thomas,4.8,2018,Fiction
The Help,Kathryn Stockett,4.8,2009,Fiction
"The House of Hades (Heroes of Olympus, Book 4)",Rick Riordan,4.8,2013,Fiction
The Hunger Games,Suzanne Collins,4.7,2010,Fiction
The Hunger Games (Book 1),Suzanne Collins,4.7,2011,Fiction
The Hunger Games Trilogy Boxed Set (1),Suzanne Collins,4.8,2011,Fiction
The Immortal Life of Henrietta Lacks,Rebecca Skloot,4.7,2010,Non Fiction
The Instant Pot Electric Pressure Cooker Cookbook: Easy Recipes for Fast & Healthy Meals,Laurel Randolph,4.3,2017,Non Fiction
The Last Lecture,Randy Pausch,4.7,2009,Non Fiction
"The Last Olympian (Percy Jackson and the Olympians, Book 5)",Rick Riordan,4.8,2009,Fiction
The Legend of Zelda: Hyrule Historia,Patrick Thorpe,4.9,2013,Fiction
The Lego Ideas Book: Unlock Your Imagination,Daniel Lipkowitz,4.4,2011,Childrens
The Life-Changing Magic of Tidying Up: The Japanese Art of Decluttering and Organizing,Marie Kondō,4.5,2015,Non Fiction
The Litigators,John Grisham,4.4,2011,Fiction
"The Lost Hero (Heroes of Olympus, Book 1)",Rick Riordan,4.8,2010,Fiction
The Lost Symbol,Dan Brown,4.2,2009,Fiction
The Love Dare,Stephen Kendrick,4.8,2009,Non Fiction
The Magnolia Story,Chip Gaines,4.9,2016,Non Fiction
"The Mark of Athena (Heroes of Olympus, Book 3)",Rick Riordan,4.8,2012,Fiction
The Martian,Andy Weir,4.7,2015,Fiction
The Maze Runner (Book 1),James Dashner,4.5,2014,Fiction
The Meltdown (Diary of a Wimpy Kid Book 13),Jeff Kinney,4.8,2018,Childrens
The Mueller Report,The Washington Post,4.6,2019,Non Fiction
The Nightingale: A Novel,Kristin Hannah,4.8,2015,Fiction
The Official SAT Study Guide,The College Board,4.4,2010,Non Fiction
"The Official SAT Study Guide, 2016 Edition (Official Study Guide for the New Sat)",The College Board,4.3,2016,Non Fiction
The Paris Wife: A Novel,Paula McLain,4.3,2011,Fiction
"The Pioneer Woman Cooks: A Year of Holidays: 140 Step-by-Step Recipes for Simple, Scrumptious Celebrations",Ree Drummond,4.8,2013,Non Fiction
"The Pioneer Woman Cooks: Dinnertime - Comfort Classics, Freezer Food, 16-minute Meals, and Other Delicious Ways to Solve…",Ree Drummond,4.8,2015,Non Fiction
The Pioneer Woman Cooks: Food from My Frontier,Ree Drummond,4.8,2012,Non Fiction
"The Plant Paradox Cookbook: 100 Delicious Recipes to Help You Lose Weight, Heal Your Gut, and Live Lectin-Free",Dr. Steven R Gundry MD,4.5,2018,Non Fiction
"The Plant Paradox: The Hidden Dangers in ""Healthy"" Foods That Cause Disease and Weight Gain",Dr. Steven R Gundry MD,4.4,2018,Non Fiction
The Pout-Pout Fish,Deborah Diesen,4.8,2017,Fiction
The Power of Habit: Why We Do What We Do in Life and Business,Charles Duhigg,4.6,2012,Non Fiction
The President Is Missing: A Novel,James Patterson,4.3,2018,Fiction
The Racketeer,John Grisham,4.3,2012,Fiction
"The Red Pyramid (The Kane Chronicles, Book 1)",Rick Riordan,4.6,2010,Fiction
"The Road to Serfdom: Text and Documents--The Definitive Edition (The Collected Works of F. A. Hayek, Volume 2)",F. A. Hayek,4.6,2010,Non Fiction
"The Serpent's Shadow (The Kane Chronicles, Book 3)",Rick Riordan,4.8,2012,Fiction
The Shack: Where Tragedy Confronts Eternity,William P. Young,4.6,2009,Fiction
The Short Second Life of Bree Tanner: An Eclipse Novella (The Twilight Saga),Stephenie Meyer,4.6,2010,Fiction
The Silent Patient,Alex Michaelides,4.5,2019,Fiction
"The Son of Neptune (Heroes of Olympus, Book 2)",Rick Riordan,4.8,2011,Fiction
